{"schema_version":"villani.telemetry_envelope.v2","event_id":"evt2_001","idempotency_key":"villani:v2:evt2_001","occurred_at":"2026-07-11T00:00:01Z","observed_at":"2026-07-11T00:00:01.010Z","sequence":1,"sequence_scope":"run:run_001","organization_id":null,"workspace_id":null,"project_id":null,"repository_id":"repo_001","run_id":"run_001","trace_id":"0123456789abcdef0123456789abcdef","span_id":"0123456789abcdef","parent_span_id":null,"attempt_id":null,"source":"controller","kind":"controller_stage","name":"run_created","status":"ok","resource":{"schema_version":"villani.resource.v2","service_name":"villani-ops","service_version":"0.2.0","deployment_environment":"local","host_id":null,"process_id":null,"attributes":{}},"attributes":{},"body":{"message":"created"}}
